text,file_name
"C'est, en elïet, une des conditions premières et nous pourrions citer des cas nombreux de séborrhée sèche (forme desquamatoire) que nous avons fait cesser en suppiimant l’usage de la poudre qui causait l’alfection et en la remplaçant par la POUDRE MONO. Nous n’avons pas hésité à la composer de produits très coûteux qui n’entrent jamais dans la coini osilion des poudres en général. Mais notre premier but est celui de soigner la peau, en la rafraîchissant et en la tonifiant.",Femina_1908-10-15_femina186-1908.txt
"Entendons-nous ; la plupart des romans, dits moraux, tombent sous le même repro- che. Je suis saisi par l’inconvenance des ouvrages destinés aux jeunes filles. Il y circule je ne sais quelle basse et honteuse volupté. Un baiser y est décrit avec des raffinements inouïs.. et commerciaux. Mais c’est un baiser de fiançailles. Jamais de same gaîté , une sorte de sournoiserie , d’hypocrisie redoutables. Je connais peu de ces ouvrages qui nous montrent le travail comme un but.",Journal_des_dames_et_des_modes_1913-03-01_journal-des-dames-et-des-modes-1-marzo-1913.txt
"3 DRASS ER RP SRE FAO SL LM A ARS CEE LE Pr PR OPPeMere Rene Ur Pa: UE A TITEE Te a Pre TE ur Du 7 DS ni fé FRE Is À us ul ET Un il his il TE ES K SU à : Area oe sal er ÉSLTESI TS ESS Supplément au n° 26 du Journal des Dames. F : PARTS de ques est là, rue Royale BARCLAY 18 et 20, avenue de l'Opéra PARIS FE RARES DS STD ESS 0 2 1 LE PRINTEMPS possède la plus belle et la plus importante collection de Tapis d'Orient, anciens et modernes.",Journal_des_dames_et_des_modes_1913-02-10_journal-des-dames-et-des-modes-10-febbraio-1913.txt
"L’on a renvoyé à l'été prochain, puisqu’il le faut, l’intime et profond plaisir de se réconforter dans la radieuse gra¬ vité et par la souveraine éloquence des pages éternelles, et de se plaire aux familières ou neuves connaissances intellectuelles. a a a Mais on n’a point rangé que ses livres. Celles d’entre nous qui ont de l'ordre et de l’économie, — et nous en avons toutes !",Femina_1908-10-15_femina186-1908.txt
"— res ornement sur les nouvelles robes , on voit beau- coup de cordelières et de glands qui pendent de tous côtés sans raison apparente; ils servent cependant quelquefois à accuser le drapé des robes et pour peu qu'une dame porte une jupe relevée devant par deux drapés d’où pendent une cordelière et un gland, sa marche est rendue très difficile, la cordelière et le gland lui battant les jambes à chaque mouvement .",Journal_des_dames_et_des_modes_1913-01-10_journal-des-dames-et-des-modes-n.23-10-gennaio-1913.txt
"Et concevez-vous , en effet, que des grappes de poivre rose, quelques branches de piment d'Afrique puissent tremper dans un honnête vase aux flancs arrondis ou de ligne régulière comme de simples roses de France, comme de beaux œillets pâles, comme un rustique bouquet de lilas? — Ah! ma chère, que c’est vieux jeu des roses, du lilas, des œillets ! Que vous retardez... Moi je ne fleuris mon salon que de calebasses orange et rouges. Voilà des fleurs ravissantes et (214) parfumées!",Journal_des_dames_et_des_modes_1913-02-20_journal-des-dames-et-des-modes-20-febbraio-1913.txt
"Pas de pièce patriotique sur laquelle les délicats ne chipotent, qu'ils ne souhaiteraient différente , à laquelle ils ne proposent des amen- dements . La partialité de l’auteur , notamment , les afflige . Oui, c'est cela qu'ils voudraient de la pièce patriotique : ils la vou- draient impartiale . Plus commode à demander qu’à réaliser. Voici par exemple Alsace. Le titre seul implique à l'avance la partialité.",Journal_des_dames_et_des_modes_1913-01-20_journal-des-dames-et-des-modes-20-gennaio-1913.txt
"Cet infini qui tremble au bord d’un bel œil pur Je l’eus. Que voulez-vous désormais que j’envie ? Ma part est la meilleure, elle est faite d’azur. Léo LARGUIER . AAA AAA IA AAA A AR AR RUE FLANERIE SUR LES BOULEVARDS. Il est encore loisible de flâner sur les boulevards, l’après-midi . Il y a des heures où les inquiétants personnages qui battent l’asphalte de la rue Drouot à la Madeleine prennent un aspect bourgeois et inoffensif.",Journal_des_dames_et_des_modes_1913-03-20_journal-des-dames-et-des-modes-20-marzo-1913.txt
Te à TETE RENE DE pute _ MR NET + Tr RO U s FE PO TO RE dns PRE 0 le dd Gars as PRE PTE 2 0 OT TERRE) sx ut à 2 1° 3 F 9 ee 4 Ÿ 16 % ‘i PEUX 1 # #1 # = See ce ; L ; | é a ° Ë T4 ?. rl ‘ : DRE 3 { ÿ x $ ; g (HOTr4 fax v. LES RSA Ÿ: Û À x ; Er. P”. A rm eee a MU 2 EN TP EE TS ES Sn nn LE SEE NE] ie 2 il qu DT Ale AMIE S# fo: Te mn m EE pan ou or 2 | pe # HSE 5 UE SIL D Li à hi S SE RS W PARFUM ULTRA PERSISTANT. ED.PINAUD PARIS.,Journal_des_dames_et_des_modes_1913-01-20_journal-des-dames-et-des-modes-20-gennaio-1913.txt
"Elle dit seulement : «C’est du style fran- çais. » Telle est sa façon de montrer du patriotisme , et je l’en approuve . Etelle ajoute , tout de suite après : « C’est chic », ou « pas chic ». Critérium que je juge excellent et même définitif : elle sait les choses qui lui vont. On n’en saurait demander davantage. Je l’interrogeai des yeux . Elle répondit: — Jevous montrerai Stecky , mon cher Stecky . C’est un chien qu’on vient de me donner, un chien du Kamtchatka. Tout ce qu'il y a de plus rare !",Journal_des_dames_et_des_modes_1913-02-01_journal-des-dames-et-des-modes-1-febbraio-1913.txt
"Chaque heure apporte un complément aux connaissances acquises et, pendant que les uns, cloîtrés dans le recueillement des laboratoires, cherchent, trouvent et perfectionnent, d'autres s’élancent courageusement en ballons ou en traîneaux, à la conquête des promontoires de glace et des déserts brû- lants, rares lambeaux de la Nature inex- ploree. Un vaillant parmi les vaillants tombe foudroyé au champ de gloire, tué par le microbe d'une épouvantable maladie dont 11 cherchait le remède.",Femina_1901-03-01_femina1-3.txt
"MAISILV A PARIS, U, RIE PlliALLE Contenance : 171 mètres environ. Revenu net : 11.000 francs environ. Mise à prix : 186.666 francs. S’adr. à M* 8 G. Pimont, Chevet, Dubail. avoués; Cousin, notaire. au Palais, à Pari>, le 21 octobre 1908, à 2 heures, de 20 hectares 84 ares 76 centiares de terres communes de ÏILLl'IS, MIEN-SIMM ET MET. Canton de Bray-sur-Seine, arrondissement de Provins (Seine-et-Marne). Revenu net : 2.084 fr. 60. Mise à prix : 40.000 francs.",Femina_1908-10-15_femina186-1908.txt
"Durant tout notre goûter il se montra spirituel et plein de ce qu’Alfred de Musset appelait « desinvoltura » . Il nous entretint des dernières œuvres littéraires et des personnages en vue, narra finement le dernier potin — comme s’il pouvait y avoir un dernier potin ! -— flirta avec une grâce exquise, nous décocha des compliments , fut léger , badin, éloquent , bref un chérubin à l’âge que nous lui donnons de nos jours, c’est-à-dire quarante-cinq ans.",Journal_des_dames_et_des_modes_1913-01-10_journal-des-dames-et-des-modes-n.23-10-gennaio-1913.txt
"re V FEMINÂ ” MUSICA ” créera de nouveaux cours , noiera tes cours existants, si la demande en est faite par six élèves au moins. Pour tous renseignements, s'adresser à t Administration du Conservatoire de 2 heures à 6 heures. Hôtel des Publications Pierre Lafitte ù C lc LETTRES A La dernière fois que je vins à l’hôtel de Femina , je rencontrai dans le vestibule le secrétaire de la rédaction, qui m’aborda et me dit de sa voix la plus insinuante : j t .",Femina_1908-10-15_femina186-1908.txt
"(ST COMPAGNIE ANONYME D'ASSURANCES contre l’'INCENDIE, fondée en 1828 Capital social et réserves : 32 Millions 519.478 francs Sinistres payés depuis l’origine de la Compagnie 443 Millions Primes encaissées en 1911: 34 Millions COMPAGNIE FRANÇAISE d Assurances contre Fondée en 19099 LE VOL SOCIËÈTÉ ANCNYME au Capital de 4 millions (1/4 versé) VOLS, DÉTOURNEMENTS, DÉGATS ET PERTES EN: GÉNÉRAL BARCLAY 18 et 20, avenue de l'Opéra LE PRINTEMPS importante collection de Tapis d'Orient, anciens et modernes.",Journal_des_dames_et_des_modes_1913-01-20_journal-des-dames-et-des-modes-20-gennaio-1913.txt
"Sa gracieuse fille, la reine Wilhelmine,aime également beaucoup les chiens, mais elle préfère encore les chevaux ; rompant avec l'étiquette qui voudrait que la reine fût toujours en voiture, il lui arrive très sou- vent de conduire elle-même à deux ou à quatre, et dans ce sport elle rendrait des points aux meilleurs de nos coachmen. Après le nain, le géant. Celui-ci est, je crois, le plus grand chien existant.",Femina_1901-03-01_femina1-3.txt
"1 volume LE PETIT MAGAZINE DE LA J EUNESSE, élégamment broché. Savait Bernhardt , par Chartran, ma¬ gnifique héliogravure en taille-douce. 1 élégante POCHETTE DE LUXE, dos et coins toile, renfermant, soit : Six gracieux hors-texte en couleurs (portraits de femmes), du Maître J.",Femina_1908-10-15_femina186-1908.txt
"dehors des Vendredis, des Conférences par séries qui seront faites par les litté¬ rateurs et les artistes les plus chers au public. Déjà MM. Abel Hermant et Hugues Le Roux ont bien voulu nous promet¬ tre leur talentueux concours. N’est-ce pas encore une bonne nouvelle que je vous annonce ? Maintenant, le prix des places : com¬ me l’année dernière, les fauteuils seront à 3 francs, les loges à 4 francs.",Femina_1908-10-15_femina186-1908.txt
"Dès qu’elles ont, en effet, une minute de tranquillité, c’est pour prendre la pose, l’attitude, et faire le geste qui est la caractéris- tique de celui ou de celle à qui elles appartiennent. L’avare serre les doigts, le prodigue les ouvre, l’énergique rassemble le poing, ...",Journal_des_dames_et_des_modes_1913-03-20_journal-des-dames-et-des-modes-20-marzo-1913.txt
"Grande erreur : vous n’inspirerez ni confiance, ni sympathie, vous ne serez de votre vie l’ami des femmes, si vous avez l’épigramme facile et l’es¬ prit trop acéré. Au lieu qu’un jeune homme dont la bonté supérieure et dédaigneuse à la fois, dont la charité raffinée se montre par des : « A quoi bon ?... Laissons donc les gens tranquilles... Ne critiquons que nous-mêmes...",Femina_1908-10-15_femina186-1908.txt
"» 67 tient à cette catégorie nombreuse de Français qui n’ont qu’une seule préoc- cupation: le plaisir. J'ai rangé mon père et ma belle-mère dans la classe des sentimentaux. Jusqu’à nouvel ordre, il me faut considérer leur fils comme appartenant à l’autre classe, celle des joyeux farceurs. Je dis « leur fils », car je ne sais pas lequel des deux parents s'applique le plus à dorloter ce chérubin, fort et découplé comme le jeune David de Michel-Ange.",Femina_1901-03-01_femina1-3.txt
"— Joli trotteur de gros grain colibris, garni d’un nœud de velours noir et plaques sou- tachées. 28 fr. N° 2. — Toilette nouvelle en cachemire souple banane, garni d’une ceinture nouvelle en satin noir, petit gilet broderie turc. . . . 200 fr. Grand canotier de feutre persan garni d’une draperie de liberty et rose monstre même ton. Lo Stella. Le Catalogue est envoyé franco sur toute demande. Le Tailnr. N° 3 .",Femina_1908-10-15_femina186-1908.txt
"Ainsi parla cette petite dame. Quand elle eut terminé, onlui apporta une facture qu’elle examina avec les sourcils froncés et la gravité d’un comptable : — Dites, déclara-t-elle à la femme de chambre, que quand une petite couturière veut se faire payer comptant , je lui retiens toujours dix pour cent, que je ne paie ni les centimes, ni le timbre, et enfin qu ie passe à la fin du mois...",Journal_des_dames_et_des_modes_1913-01-10_journal-des-dames-et-des-modes-n.23-10-gennaio-1913.txt
NICOLL ù C°Ltd Par suite des agrandissements l’entrée du Rayon pour Dames est à 1 angle de la rue Tronchet et de la rue des Mathurins Manteaux tout faits et prêts à porter Etoffes anglaises en pure laine Costumes à partir de 175 francs Coupe et Façon très soignées Maison renommée pour amazones en tousgenres Costumes et - —: = Manteaux inédits Nouvelles Créations Amazones à partir de = 175 fr.,Femina_1908-10-15_femina186-1908.txt
"SEGUIN, Bordeaux MEMBRE du JURY HORS CONCOURS Exposition Universelle Paris 1900 —_ « irc- rt -»» CT ) à PARIS, 26, Rue d’Enghien. ""* AISaC>:i!SÏ 13 ‘ à LONDRES W„ 30, Gerrard Street.",Femina_1908-10-15_femina186-1908.txt
"AAA Rosine , Martine et Colin, tels sont les prénoms des trois enfants d’un fameux couturier parisien . Trois prénoms assuré- mentmoins fréquents que Pierre ;, Paulet Marie , mais qui fleurent bonla bonne vieille etfamilière tradition française . Notre couturier parviendra-t-il à en imposer la mode comme il imposa naguère celle des entravées et des tuniques persanes ?",Journal_des_dames_et_des_modes_1913-01-10_journal-des-dames-et-des-modes-n.23-10-gennaio-1913.txt
"Néanmoins, tous ces traits manquent de la généralité et de l’ac- tualité quiengendrentchezlespectateurlerireetlaconfiance . Pour moi , jy préfère de beaucoup deux ou trois scènes de révolte où la jeune Iphigénie, immolée sur l’autel du snobisme, dit avec fièvre à ses bourreaux leurs quatre sous de vérité. Là, nous retrouvons toutentier l’artdélicat, mesuré et souvent fort de M.",Journal_des_dames_et_des_modes_1913-02-10_journal-des-dames-et-des-modes-10-febbraio-1913.txt
"Il possède comme une force de volonté magnétique dans le regard, ce garçon qui, au Cours de la vie, paraît ne pas savoir ce qu’il veut. Je découvre en lui des contradictions que je ne comprends pas. C’est peut-être que je ne me soucie pas de les comprendre. Bref, nous étions dressés face à face en des dispositions passablement agressives, quand l'attitude de ma belle-mère produisit une diversion. Elle fondit en larmes. : Bon! Nous voilà tous les deux à la consoler.",Femina_1901-03-01_femina1-3.txt
"Le décor était,en effet, délicieux : des brumes matinales enveloppaient les lignes ondulantes d'un paysage de dunes recouvertes de broussaille, une brise fraîche nous apportait des odeurs de la mer. Je m’attendais à un spectacle dans le genre de celui que nous prenons à Pau. J’étais loin du compte. Ces Américains font toutes choses à leur manière (notez que je ne dis pas que la leur soit mauvaise ni la nôtre bonne).",Femina_1908-10-15_femina186-1908.txt
"30 à leur demande) ; 2 0 Tout numéro abîmé ou mal paginé est remplacé gratuitement à nos abon¬ nées, à condition qu’il nous soit retourné, et qu’une carte postale nous indique le motif du retour ; 3 0 Toute abonnée peut avoir les nu¬ méros qui manquent à sa collection de l’année en cours avec un rabais de 50 0/0; 4 0 De nombreux concours sont ré¬ servés aux abonnées ; 5 0 Nos abonnées reçoivent toujours leur publication avant qu’elle ne soit mise en vente.",Femina_1908-10-15_femina186-1908.txt
"enfin la nature etle tempérament de chacun se manifestent par la façon d'être des mains, par leur mine, l'expression offensive ou défensive de leurs traits, car elles ont des traits, une mimique mobile autant qu'un visage; il y a des jours où les mains sont claires, transparentes, et d’autres où elles sont obscures et «tirées», Je sais voir tout de suite si elles sont contentes où ennuyées, si elles ont passé une bonne nuit ou non , si elles sont sages ou folles.",Journal_des_dames_et_des_modes_1913-03-20_journal-des-dames-et-des-modes-20-marzo-1913.txt
"La foule elle-même, qui les regarde passer , s’abandonne à ses instincts les plus désordonnés. On n’entend que cris d'animaux, apostrophes virulentes , interjections obscènes , glapissements de camelots à demi ivres: ( Qui n’a pas son kilo ? A un sou le verre, les confetti unicolores !",Journal_des_dames_et_des_modes_1913-02-10_journal-des-dames-et-des-modes-10-febbraio-1913.txt
"Les invités sont choisis avec largeur, en général , parmi les personnes inscrites ( 200 ) au Tout-Paris. L’invitation porte un dessin , en général horrible et qui donne le plus détestable avant-goût du spectacle auquel on est convié. Il y a un tourniquet à la porte. Personne ne passe par le tourniquet . On parle, cependant , d’un Péruvien. Mais il y a queue à la barrière des ( cartes ».",Journal_des_dames_et_des_modes_1913-02-01_journal-des-dames-et-des-modes-1-febbraio-1913.txt
"Maison Bousquin, 25, galerie Yivienne, Paris. Expédition. Ca¬ talogue franco sur demande. DIVERS Bicyclette « Scleveland » 1908, ré¬ clame donnée gratis à toute personne, tous pays, qui s’occupera, à temps perdu, du Placement. Impérial, 163, rue Mont¬ martre, Paris. Mme Debora; 5, rue du Bac. — Célèbre prof, de sciences occultes, univers, connue : Voyance par cristal, verre d’eau, coquil¬ lages, etc. Tarots chaldéens (inconnus). Somnambulisme. Corresp. Chiromancie.",Femina_1908-10-15_femina186-1908.txt
"En fait de lettre, un longue pièce de vers, pas plus médiocres que tant d’autres , dans laquelle il chantait ses malheurs , le tout accom- pagné d’un « envoi » célébrant mes mérites et ma générosité à laquelle il n'aurait pas recouru en vain . Il se présentait le lende- main chez moi et, en se retirant, il me priait de lui rendre sa poésie . Il en avait sans doute le placement autre part . C’étaitun économiste ; il mettait en pratique la théorie du moindre effort.",Journal_des_dames_et_des_modes_1913-02-20_journal-des-dames-et-des-modes-20-febbraio-1913.txt
"| § a Crème de perles fines (pour les ongles). . Prix 2 fr. “ .J ajouter o fr. ;o par échantillon pour emballage et port recommandé. DEMANDER LE PRIX COURANT ILLUSTRÉ Pour FILLETTES. Costumes vrnie Serge bleue marine (jupe plate ou plissée). Vareuses doublées flanelle pour 1 hiver. Costumes Coutil blanc ou rayé marine et aussi en Serge blanche, écarlate ou noire. Accessoires et tissus au mètre peuvent sur demande eue obtenus séparément.",Femina_1908-10-15_femina186-1908.txt
"Pour les concours appelant une solution précise et qui réu- nissent plusieurs solutions exac- tes, le nom de la gagnante est tiré au sort parmi ces dernières. Pour les Concours artistiques comportant un élément d'appré- ciation, le prix est décerné par un jury composé de nos collabo- ratrices et de nos dessinateurs.",Femina_1901-03-01_femina1-3.txt
"2 e Prix : Un pendentif fix. Mme Flo- ret, à Losne (Côte-d’Or): 3.200 ré¬ ponses. 3® Prix : Deux épingles a chapeaux. G. Buteaux à Paris, 3.226, réponses. La boîte et les coquillages. Nous adressons toutes nos félicita¬ tions à nos lectrices pour leurs jolis envois. Nous avons comme suit : attribué les prix I er Prix : [Un sautoir et une bourse titre fix. Mme Delauvo, à Bruxelles. Souvenirs. P. Petit, 21, rue de la Place, Caen: J.",Femina_1908-10-15_femina186-1908.txt
"En réalité, il n’y a qu’un mois d’automne, celui des feuilles rousses, des dahlias durs, des roses mourantes, et il y a cinq mois d’hiver, ceux déjà pluie, du vent, de la neige, de la boue, ceux où pn se gare de la nature, où elle n’est plus l’enjô¬ leuse amie, pleine d’offrandes parfumées, mais l’ennuyeuse et monotone et traîtresse ennemie. De sorte que si nous ne sommes pas encore exacte¬ ment en hiver, en ce moment, nous sommes déjà en pleine saison hivernale.",Femina_1908-10-15_femina186-1908.txt
"Baxton, à New-York. Les Marguerites, 10 juillet. Ta lettre, tante darling, m'a vraiment bien amusé. Comment! tu as pu trouver dans ce que je t'ai écrit des sujets d'inquiétude sur la sécurité de mon cœur! C’est à mourir de rire. Et tu vas voir si l'événement contre- dit tes prévisions. Mais d'abord, te rends-tu compte que tes alarmes t'ont « refrancisée » au point que tu fais des sermons à ta grande nièce, et t'efforces de la mettre sur ses gardes.",Femina_1901-03-01_femina1-3.txt
"EAU ge TOILETTE à Eur | AFRARARINER à , 1 Tibrairie sportive ÆAAAAAAAAANAAANAAA/AAANAAA/NAAAAR de Choix A A D, Chocolats. _- 5 ESS Vins du Midi,ete. de la VIE VIE AU GRAND AIR — VE IV VV IV IV IV I VIN I VTT V TE TV TV TV TV TV TV: V | Tous les Livres de Sport. QeesearaanaaneaRaReRRRRRRRARRARAREDARSEeADE A) EN VENTE PARTOUT ce PARIS = { ee Dr ù ii orme .M. 4 Impératrices Romaines à _æÆ.",Femina_1901-03-01_femina1-3.txt
"Lorsqu'on n'est rien qu’un homme, l’idéalisme ,le goût du silence et de la fantaisie vous désignent à tous les coups ; lors- qu’on est roi, cela devient terrible.",Journal_des_dames_et_des_modes_1913-03-10_journal-des-dames-et-des-modes-10-marzo-1913.txt
"0 0 0 Or, par une auguste soirée de juin, Lionel devi¬ sait en un des somptueux jardins de Saint-James avec la tonte belle Mme Maud Forster, veuve d’un marchand de pétrole, millionnaire à souhait. Un demi-clair de lune caressait la terre, pas une feuille des arbres pâles ne bougeait, et seul, furtif et doux, un samovar susurrait et ronronnait près d’eux au milieu du grand silence. Mme Forster sp sentait tendre et recueillie. Lionel lui dit qu’il l’adorait. Il fut irrésistible, que voulez-vous ?",Femina_1908-10-15_femina186-1908.txt
"Dans les mou- choirs habillés la dentelle domine. La dentelle en incrus- tation, et non pas la badinée, comme on les faisait naguère, pour tous les mouchoirs ha- billés. Par l'examen de ces différentes pièces, on remarquera que la tendance n’est pas seu- lement d'employer la : 13, dentelle en garniture, mais bien de lunir à l'étoffe d’une façon assez , ; & intime pour qu'elle fasse corps et se confonde en quelque sorte avec elle.",Femina_1901-03-01_femina1-3.txt
"Elle comprend cette année six vo¬ lumes richement reliés avec couverture en couleurs que viennent rehausser de beaux filets d'or; ces six volumes, con¬ tenus dans un solide et élégant carton¬ nage formant bibliothèque, ont pour titre : Gulliver, Robinson Crusoé, Guil¬ laume Tell, Don Quichotte , les Contes d’A ndersen, et les Contes de Grimtn. Chacun d’eux contient 8 planches hors texte en quatre couleurs.",Femina_1908-10-15_femina186-1908.txt
"Mais il faut les plaindre d'ignorer cette joie pro- fonde et savoureuse : découvrir un auteur . I y avait, jadis, un millier de fanatiques qui achetaient fout. J'entends tous les livres qui paraissaient. La dépense n’avait rien d’effroyable . Ainsi , elles faisaient elles-mêmes, sans se fier à la critique souvent débordée, parfois mal renseignée , leur petit travail d'élimination.",Journal_des_dames_et_des_modes_1913-01-20_journal-des-dames-et-des-modes-20-gennaio-1913.txt
"Nous ne préten- dons parler ici que de ce dont nous sommes bien assurés. Et les Souvenirs du vicomte de Courpière , il faut l'avouer, nous sont mieux connus que la vie de Gargantua , comme les Mémoires du Cadet de Coutras plus familiers que les aventures de Pantagruel. Ce qui s’écrit de l’un , d’ailleurs , ne peut-il s’appliquer à l’autre ? Vaille que vaille, on voit bien que si; M.",Journal_des_dames_et_des_modes_1913-02-01_journal-des-dames-et-des-modes-1-febbraio-1913.txt
"Les nouvelles d’un journal appa- raissent ordinairement au lecteur tranquille comme des faits reculés , des faits d’histoire le touchant à peine . Elles ne l’em- pêchent ni de dîner à l’heure coutumière , ni d’aboyer à la lune, entre amis, devant un apéritif, ni d'inventer des plans et des tactiques .",Journal_des_dames_et_des_modes_1913-01-20_journal-des-dames-et-des-modes-20-gennaio-1913.txt
"Et, comme les héros de contes de fées, l’œuvre naissante eut une mar¬ raine, la meilleure des marraines, toujours prête à favoriser de son accueil, de ses conseils, de son appui généreux, une initiative destinée à répandre sur des êtres laborieux une chance nouvelle de bien-être et de sécurité. Il y a environ une quinzaine d’années, je voya¬ geais en Grèce, et j’observais, au musée de l’Acro¬ pole, de beaux plis sculptés reproduisant les dra¬ peries de très anciennes étoffes grecques.",Femina_1908-10-15_femina186-1908.txt
"Ilest de moire rouge et garniunique- ment des petites cordelières rituelles. Les souliers sont de che- vreau noir à boucles d'argent sur pattes de chevreau rouge . Aux gants de soie rouge , que quelques dames jugent le complé- ment logique d’une telle toilette, une véritable élégante préférera de simples gants de soie ou de suède , blancs ou noirs, qui sont plus modestes et, par conséquent, plus opportuns pendant le Carême. A la feuille de ce jour sont jointes les gravures 54 et 55.",Journal_des_dames_et_des_modes_1913-02-10_journal-des-dames-et-des-modes-10-febbraio-1913.txt
"Il est de rigueur, cependant, chez les raffinées, de n’avoir sur un transparent à peine teinté que des nappes où les fils tirés et retournés forment des jours qui , repris etrecouverts à l'aiguille , donnent de merveilleux dessins defleurs, fruits , animaux ou personnages. Et cela fait avec les serviettes ornées d’un seul rang de jours dans le même style un ensemble homogéne et parfait.",Journal_des_dames_et_des_modes_1913-01-01_journal-des-dames-et-des-modes-n.-22-1-gennaio-1913.txt
"0 On annonce le prochain mariage de Mlle Lydia Fischhof, fille du sportsman bien connu, avec M. Pierre Giltou, fils du grand industriel récemment décédé. Le mariage aura lieu dans, les premiers jours de novembre. Chasse à courre. 0 L'équipage de M. Paul Lebaudy chassera en forêt de Dreux et de Fontai¬ nebleau tous les samedis et le mercredi tous les quinze jours, à partir du 21 octobre. Hors PaTls. 0 La saison à Venise a été cette année des plus brillantes.",Femina_1908-10-15_femina186-1908.txt
