text,file_name
"Ne souris pas. Ne crois pas que ma fermeté de jugement mollisse pour quelques flatteries ou câlineries. Tu sais qu’on ne me prend guère de la sorte. Et je n'y prête pas, je t'assure. Si tu étais ici, et que tu voulusses à toute force me chapitrer un peu, tu me reprocherais ma rudesse plutôt que ma complaisance aux enjôleries françaises. Mon goût pour les situations nettes me fait souffler trop vite et trop fort sur les châteaux de cartes. Tiens, en ce moment, j'ai un remords...",Femina_1901-03-01_femina1-3.txt
"MONO EPIL (Epilatoire parfumé) à l Eau de Cologne Russe . (Garanti sans arsenic, ni chaux). S’il est un inconvénient insupportable dans l’application des dépilatoires, c’est bien cette odeur repoussante qui fait que bsaucoup de daines préfèrent garder leui puositu que de s’exposer à cette terrible épreuve qui souvent les fait se trouver mal. Sa formule toute personnelle à son inventeur, est absolument différente de toul ce qui a été fait jusqu'à ce jour.",Femina_1908-10-15_femina186-1908.txt
"— Le prix de l'abonnement est fizé à 100 francs par an pour la France et 120 francs pour l'Etranger . Il est tiré en sus 29 ex. de luxe : dont 5 sur vieux Japon avec 3 états des grav. à 500 fr. par an; 12 sur Japon impérial avec 2 états à 300 fr. et 12 sur Japon impérial à 200 fr. — Il n’est pas accepté d'abonnement d’une durée inférieure à un an. AAA AAA VU VE VE LE LUE VV AAA AAA AAA AA AA AAA IAA AAA AA AAA AA AR PARIS. Ce 19 Février, 1913.",Journal_des_dames_et_des_modes_1913-02-20_journal-des-dames-et-des-modes-20-febbraio-1913.txt
"ANA AA AA AR AA I A AE AR A AE ÉNIGME Malgré mon sexe féminin, Et malgré que , dit-on, les belles Reviennent un peu du dédain Qui les faisait me rejeter loin d'elles, C’est dans l'intimité de l’homme Que lon me voit plus volontiers , en somme, L’accompagnant soir et matin, Toujours à portée de sa main, Et ne le quittant guère ailleursque dans le bain.",Journal_des_dames_et_des_modes_1913-02-20_journal-des-dames-et-des-modes-20-febbraio-1913.txt
"et M ra0 Fernand DEPAS 1 Cours par semaine 000 40 francs par mois 0 0 0 12 élèves AUD IT EUR S . -- Chaque cours comprendra, outre les élèves, un nombre d auditeurs illimité. Le titre d’auditeur donne le droit d’assister à la classe sans y prendre une part directe. Le prix payé par les auditeurs est de 10 francs nar mois et par cours.",Femina_1908-10-15_femina186-1908.txt
"Nous verrons aussi beaucoup de robes de velours ou de satin météore, ouvertes sur des guimpes à clair, soit en tulle ou en dentelle; les manches plates devront être du même tissu que la guimpe. Cependant, on remplace quelquefois, et c’est une idée nouvelle, ces guimpes de tulle par des plastrons de broderies en perles blanches, en ce cas, les man¬ ches sont en même tissu que la robe.",Femina_1908-10-15_femina186-1908.txt
"La troisième est une tunique de liberty blanc qui se simplifiera par un joli ourlet à jours à la hauteur de la partie supérieure de la broderie Sim plice. LE JEUNE HOMME THÉ Ah! ma chère, il était exquis ! Il avait une manière, un joli ton simple et confi¬ dentiel pour dire à propos de toute femme, jeune ou vieille, mariée ou non, que l’on citait devant lui : « J’ai beaucoup d’affection pour elle. C’est mon amie. »> Et quelle personne un peu sensible, en effet, aurait pu n’être pas son amie ?",Femina_1908-10-15_femina186-1908.txt
"...— Je crois que Madame de Staël et Madame de Rémusat sont affligées . .. en ce qui concerne leurs personnalités respectives. .. de ce même défaut de vision... LE BARON LARREY (bourru). — Elles ont une maladie bien connue ... l’hypertrophie du Moi..... Lais. — C’est étonnant , ce qu’il entre de gens chics ce soir aux Variétés! ... C’est un défilé de jolies femmes... et si bien habillées !. .... Louis XIV (1! regarde Laïs avec admiration) . — C’est vous, Mademoiselle, qui êtes bien habillée! ...",Journal_des_dames_et_des_modes_1913-01-10_journal-des-dames-et-des-modes-n.23-10-gennaio-1913.txt
"4 francs Fauteuils. . . 3 francs En location, r fr. de plus par place. LE THÉÂTRE FEMïNA PEUT ÊTRE LOUÉ PAR DES PARTICULIERS Le Théâtre Femina est, sans conteste, le plus coquet et le plus confortable de Paris. Il contient 5 oo places (34 loges et 3 oo fauteuils). Plancher incliné et horizontal. De nombreuses améliorations concernant les dégagements de la scène, les loges d’artistes, les portes de secours et la ventilation ont été faites pendant les vacances. Le tarif de location.",Femina_1908-10-15_femina186-1908.txt
"Soulignés de commentaires qui en doubleront l'intérêt, le cinéma¬ tographe et la lanterne magique alterneront avec des attractions soigneusement choisies : clowns, prestidigitateurs, ou animaux savants; il y aura des danses, des monologues et des chansons; il y aura des tombolas ; on jouera des petites pièces, des charades et des proverbes, tout un répertoire établi avec un souci d’art et de bon goût qui en proscrira toute niaiserie.",Femina_1908-10-15_femina186-1908.txt
"— La belle Ninon de Lenclos ne se servait que du Duvet de Ninon et cette poudre de riz donnera à votre peau blancheur diaphane. La boîte est vendue 3 fr. 75, fco 4 fr. 25, à la Par¬ fumerie Ninon, 31, rue du 4-Septembre.",Femina_1908-10-15_femina186-1908.txt
"sans oublier les soins qu’ap- pelle l’organisation d’une vente comme celle dont nous parlons aujourd’hui. *# % Il est vrai que le succès est une bien douce indemnité, et quelques-unes de nos lectrices savent, pour l'avoir vu, le succès de la vente de cette année. Quel gracieux affairement chez ces dames et comme il faut leur savoir gré d’avoir permis au photographe de Femina de les encombrer de son appareil en un pareil moment!",Femina_1901-03-01_femina1-3.txt
"que des « Bienfaiteurs » ressem- blant fort à ceux de M. Brieux se peuvent rencontrer de par le monde. Mais ce qui fait heureu- sementde cette peinture pessimiste un simple paradoxe, c’est que, s'en tenant de parti pris à toutes les manifestations qui sont la « façade » indispensable d’une œuvre de bien, elle néglige vo- lontairement le fond même de cette œuvre et tout l'effort caché, mais souvent considérable, qu’elle représente.",Femina_1901-03-01_femina1-3.txt
"contours qu’à une création musculature s’efface ou se diwin ! 8 1 ^ xa 8 ^ r( -T s clu corps disparaissent. 1 incohérence do la N’est-ce point grâce à ce modèle d^ctéselon >l los rTnfoi e ri C lai A S s . em ^ lenl Patries et remaniées, élégantes, aujourd’hui conservent tant d'aisance§£s=’ q "" C toutes,,ÜS -- -Vji.v milles nus T? . ( j -i plus parfaite harmonie des contours.",Femina_1908-10-15_femina186-1908.txt
"Mais il y a mieux encore : ces gilets sont souvent de gros damas ou de satin broché, de couleurs vives, ou d’étoffes quelconques à gros ramages , tous tissus essentiellement modernes. Parfois , au contraire , 1lsontété tout simplement «repris » dans un authentique gilet de quelque seigneur du temps de Watteau , et parfois encore taillés à même quelque vénérable chasuble ancienne. Sacrilège, double sacrilège.",Journal_des_dames_et_des_modes_1913-01-20_journal-des-dames-et-des-modes-20-gennaio-1913.txt
"AAAAARAAA RAA IA AAA AA AR AAA SAS AA AAA RAA ARR, AA AA AS LAS) RAS AAA AR LES AVE AANAAA Ce Journal paraît tous les dix jours, le 1%, le 10 et le 20 de chaque mois. Chaque numéro contient de une à cing Gravures coloriées : Modes, Meubles et Bijoux. — Les bureaux sont : rue La Boctie, n° 62. AAA VAR AASRAAS AAA AAA AAA AA AAA VER AAA APR AAA SAS AAA AA AA AAA AR AAA L22) Le tirage est limité à 1.250 ex. numérotés.",Journal_des_dames_et_des_modes_1913-02-20_journal-des-dames-et-des-modes-20-febbraio-1913.txt
"Naturellement,tout voyageur reconnu malade ou même suspect est retenu à la frontière et soigné dans un local spécial. Celui auquel a été délivré un passe- ort sanitaire est l’objet d’une surveil- ance toute spéciale à l’adresse où il a déclaré se rendre, et ce, pendant une pé¬ riode de cinq jours. Si dans ce délai le voyageur change de ville, il devra en aviser les autorités.",Femina_1908-10-15_femina186-1908.txt
"ANA AA AR VAE AL AL ELLE À la feuille de ce jour sont jointes les gravures 44, 45, 46, ainsiqu'une gravure hors série : le Choix difficile, par M. Ch. Mar- tin, que le Journal des Dames dédie à tous ses souscripteurs, collaborateurs et amis pour leur souhaiter la bonne année.",Journal_des_dames_et_des_modes_1913-01-01_journal-des-dames-et-des-modes-n.-22-1-gennaio-1913.txt
"Aussi avons- nous trouvé inutile d’établir un examen d'entrée et de fixer une limite d’âge. De même, pour que ces cours donnent aux élèves toutes satisfactions, nous avons limité le nombre des élèves dans chaque classe. Il est bien certain que toutes les classes cependant pourront être dédoublées si besoin était. Pour compléter ces renseignements, deux matinées d’élèves seront données pendant le courant de la saison au Théâtre Femina.",Femina_1908-10-15_femina186-1908.txt
"Pour les points noirs, en se couchant, étendre sur la figure de l'huile d'olive pure, et, au fur et à me- sure que les points noirs sont moins durs, les resser en les lotionnant ensuite avec de l’eau boriquée. Je tiens une crème spéciale de la maison à votre disposition. Grande propreté de la peau. M. R.. — Remerciements pour votre tout ai- mable lettre. Je ferai tout ce qui dépendra de moi pour vous donner satisfaction.",Femina_1901-03-01_femina1-3.txt
"Elle se retourna vers moi et , avec le plus délicieux sourire: — Pour nous , expliqua- ele , pour nous ce n’est pas la même chose ! HENR1 DUVERNOIS. SAIS AA AA AA A/R AA AAA MODES. Quelques jeunes filles ont emporté dans le Midi des costumes qui, pour une fois, semblent des costumes de vraies Jeunes filles .",Journal_des_dames_et_des_modes_1913-01-10_journal-des-dames-et-des-modes-n.23-10-gennaio-1913.txt
"Et il commença de s’agenouiller, malgré un solide coup de cravache . Et rien ne put lui en faire démordre. Le couple adultère passa donc devant cet hommage inattendu qu'il fit semblant de ne point apercevoir. Des imbéciles riaient. M. Bourju-Desfeuilles releva sa bête , rassembla les rênes et infligea à Fulgurant une correction parfaitement injuste , tandis qu’un quidam , à face de maquignon , s’écriait : — Qu'est-ce que vous voulez ! Ça ne sait pas! Ça n’est jamais qu'un cheval.",Journal_des_dames_et_des_modes_1913-02-10_journal-des-dames-et-des-modes-10-febbraio-1913.txt
"Gosseline , pour ma part, ne m'amuse pas moins que Panurge auquel il ressemble , et les voyages du Jeune Coutras valent bien les pérégrinations du bachelier Pantagruel et de ses com- pagnons au pays de la Dive Bouteille et autres lieux : les uns comme “= = ; . DE — Nr v# PC UA = re ÉT As ù ms ADtA NSP dr RAA D, 1e PRÉ RÉ PRE Pa ro D mn (197) les autres sont aussi ruisselants de signification , si l’on peut s'exprimer ainsi, et bons à commenter.",Journal_des_dames_et_des_modes_1913-02-01_journal-des-dames-et-des-modes-1-febbraio-1913.txt
"ces a venir essayer giatuitement les dernières créations de posfirbec -- iznvoi eut tournai • << s ’ao-t r —— La meilleure Brin a „«„ e C0 "" =,!ER “ y o rr»% T « _ _ ne se trouve que chez l'inventeur Mar,us H ENG. 33. R. ue Bergère , 33 „ PARIS 33 , Rue ‘Bergère Téléphone 210-72 PARIS Téléphone 210-72 \ Tout en s’inspirant des styles anciens, la mode doit les adapter aux besoins et au cadre de la vie actuelle.",Femina_1908-10-15_femina186-1908.txt
"(Voi.* pages, 477, 4 7 ^» description de ces toilettes.) (Composition de Lelonj», d’après les dessins de René.) I r 2. Blouse de ^ voile biscuit, avec col et manches entiè¬ rement plissées en tulle blanc. Une guimpe de den¬ telle blanche, décolletée en carré,est continuée par un blou¬ son dont la forme se découpe de façon très originale. Des motifs de sou tache ornent ce décolleté et descen¬ dent en forme de galon le long des manches.",Femina_1908-10-15_femina186-1908.txt
"qui rapporte 30 francs net d’impôts, qui est cotée à la Bourse de Paris et qui peut s'obtenir aux environs de 475 francs. Voilà, n’est-il pas vrai, un titre attrayant ? Dès que mon enquête sera terminée, j’en soumettrai les résultats et les conclusions aux lectrices de Femina.",Femina_1908-10-15_femina186-1908.txt
"Il se produisit un évanouissement et deux crises de nerfs : ne voilà-t-il pas de quoi contenter les plus ambitieux ? Ce qui étonna prodigieusement Lionel, par exemple, ce fut la conduite de sa femme lorsqu’ils revinrent de leur voyage de noces. — Avez-vous, lui dit brusquement Maud, reçu des lettres de vos créanciers ? — Mais, ma chère Maud..., je voulais juste¬ ment... Oui. j’ai trouvé quelques lettres à mon retour, en effet... Toutefois, il n’importe, rien ne presse...",Femina_1908-10-15_femina186-1908.txt
"Pour envoyer les solutions, détacher de l'une des pages d'annonces et coller sur l'enveloppe le « Bon » portant le numéro du Concours auquel on répond. Les réponses sont reçues pendant un délai de trois semaines, à dater de l'énoncé du Concours, et les solutions publiées un mois et demi à courir de la méme date. A la gagnante de chaque Concours est attribué un prix de 50 francs en marchandises de luxe, à choisir dans une des premières maisons de Paris.",Femina_1901-03-01_femina1-3.txt
"Vrai chevreau de Grenoble, 3 bouton>, garanti. 2-75 BLOUSE Irlande véritable. . . . 60 . » Vrai chevreau de Grenoble, la boutons, mousquetaire. 5.25 Grand MANTEAU Irlande véritable, longueur i m 25. 225 . » GANTS POUR HOMMES GANTS Suède, mousq r \ 12 bout. 2.90 COMPTOIR SPÉCIAL DE 100 fr.",Femina_1908-10-15_femina186-1908.txt
"RAA A A A A CINÉMA. Tu me plais et tu m'amuses , brave public des cinémas , public badaud , candide, paresseux , qui doucement mijotes dans la tiédeur des salles ! Car , au cinéma , on ne pense à presque rien, on regarde, on ne désire que regarder, de toutes ses forces. Respectables dames , vieux messieurs , jeunes gens, gamins et gamines , une foule bigarrée , heureuse de vivre , se dirige donc, chaque après-midi, puis le soir , vers les théâtres cinématogra- phiques.",Journal_des_dames_et_des_modes_1913-01-20_journal-des-dames-et-des-modes-20-gennaio-1913.txt
"mêmes rubans étroits s’en- | ’ Fig. 4 ) ; Fig, 5, E EMPIRE en drap bois avec boléro de guipure à OSTUME de drap noir. La jupe, avec volant coupé en torme, est en- ages portes, col revers en Viloues brodé bois. Manches inté- CG tourée d'un haut biais de drap noir posé sur un très étroit dépassant rieures en drap bois avec revers de velours. Chute de guipure retenue de drap pervenche. Corsage Louis XV À basquines, le devant se déta- ar des pattes boutonnées de côté.",Femina_1901-03-01_femina1-3.txt
"Leroux et Camille n’ont fait que se soumettre aux lois du genre et aux devoirs qui en résultent. J'ajouterai que leur pièce a , en bien des endroits, de Ja sincé- rité , de l'élan , même de la puissance . En plus , elle possède cette grande qualité d’être actuelle. Elle répond à un état de l’âme présente et elle récolte tout ce qu’ont semé de ressouvenir ému tant de récents ouvrages sur l’Alsace. Avec de tels éléments ; n'était-il pas fatal qu’elle réussit ?",Journal_des_dames_et_des_modes_1913-01-20_journal-des-dames-et-des-modes-20-gennaio-1913.txt
"WATTEAU. — Allons donc !.... MME DE RÉMusar. —- Je parie bien qu'ici, par exemple, on n’en trouverait pas ..... LA COMTESSE DE CASTIGLIONE. — Il y a moil.... CorA PEARL. — Moi!.... LA REINE HORTENSE .— Moil!.... LA DUCHESSE DbE BERRY. -— Moi!.... ADpDA MENKEN. — Moi!.... MME RÉCAMIER (les yeux baissés). — Moi!.... M. AMPÈRE (à Mme Récamier). — Ah!... à la bonne heure! ... Je me demandais ce que vous attendiez pour..... CHATEAUBRIAND (soupçonneux, bas à Mme Récamier).",Journal_des_dames_et_des_modes_1913-01-10_journal-des-dames-et-des-modes-n.23-10-gennaio-1913.txt
"De frêles mains lui en apportaient des tasses pleines, qu’il acceptait avec beaucoup de grâce, et qu’il épuisait... On ne l’imaginait en rêve qu’à travers une vapeur de tisane bouillante. Il finissait par en évoquer inévitablement le par¬ fum distingué, la nuance de bon ton, il était un jeune couleur thé, genre thé, le jeune homme thé. On devine que des partis avaient dû se présenter bien souvent pour cet incomparable Lionel.",Femina_1908-10-15_femina186-1908.txt
"— Oui, répondit le jeune homme, les cascades de Risleten sont plus belles, mais me plaisent moins que celle du Lieli. Celle-là, vraiment, est ma favorite à cause de sa solitude et de sa tris¬ tesse, et surtout de l’étrange attirance de ses eaux qui ont une sorte de pouvoir aimanté. — Ont-elles causé des accidents ? — Plusieurs. Encore au printemps dernier, un jeune pâtre, en voulant remplir sa gourde, a été happé par la nappe qui tombe d’une hauteur de quinze mètres.",Femina_1908-10-15_femina186-1908.txt
"Soudain , comme frappée d’une révélation , la critique s’est mise à sortir de leur étui la littérature , l’art, l’écriture , — enfin tous les grands, principes dont il n’est jamais question dans les comptes rendus coutumiérs. Et ça été des commentaires implacables sur la différence entre le théâtre et la hittérature, entre l’art et le métier.",Journal_des_dames_et_des_modes_1913-02-20_journal-des-dames-et-des-modes-20-febbraio-1913.txt
"Les nuances sont parfaites et pratiques, comme il le faut pour un grand manteau; elles sont cependant des plus seyan¬ tes, car ce vêtement est «ait pour se porter soit dans la maison, soit pour la citasse, le yachting, l a uidiuic, IC vuydgc ia uuauLc a ... > uuc wmpcuuicz uonc que 1; doit etre choisie avec un soin jaloux suivant l'usage auquel nous le destinons St vous avez quelque confiance en votre amie Caquette, elle vous donnera quelques indications sur les nuances qu’elle recommande.",Femina_1908-10-15_femina186-1908.txt
"lju H x Réputation Mondiale A* Grand Chic Extrême Légèreté Depuis cinq ans, B” HENRY, contrai¬ rement aux maisons dont le postiche est entièrement monté sur tulle, les prépare sur des bandelettes de trois cen¬ timètres au plus de ce même tulle; les vrais cheveux se mélangent aux posti¬ ches, l’eifet est naturel et des plus heu¬ reux et l’air circule librement, évitant la transpiration qui se produit toujours quand la tête est entièrement envelop¬ pée, ce qui est la cause la plus absolue de la chute des cheveux.",Femina_1908-10-15_femina186-1908.txt
"Le tricot de laine, dans les teintes rouges et ___ gros bleu, est très bon pour dé¬ fendre les enfants contre les grands froids. Nos fillettes se juponnent très court ; celles qui por- tentdeschaus- settes pendant plis de lingerie, et même les broderies de soutaches. Il b n’est pas jusqu’à la forme ZZp -de leurs vêtements qui ne ;T s’inspire de celles que nous avons adoptées.C’est ain- si que, dès le jeune âge, on habitue nos enfants à nos ^ coquetteries, à nos raffine- _ ’ ments et à nos luxes.",Femina_1908-10-15_femina186-1908.txt
"Puis, se soulevant, avec un peu de lassitude : — Ce n’est rien, c’est passé, j’ai eu, pendant un instant, une sorte de vertige. Elise et Marie-Thérèse s’empressaient. La pre¬ mière offrait son flacon de sels, la seconde trem¬ pait, dans un petit rufeseau d’eau courante, son mouchoir qu’elle appuyait aux tempes de Mlle Stalder. — Si nous n’allions pas tout à l’heure à Bülil ? dit Elise, il me semble inutile de vous fa¬ tiguer, mademoiselle. — Oui, appuya Marie-Thérèse, restons tran¬ quilles i i.",Femina_1908-10-15_femina186-1908.txt
"De bonne foi , elles finissent par s’accoutu- mer à l’idée que le temps les oublie; et voilà pourquoi l’on ren- contre dans les rues tant de dames mûres, parfois très mûres même, qui semblent vêtues et coiffées comme si elles étaient leurs propres filles. A la feuille de ce jour sont jointes les gravures 60 et 61. AREAS La reproduction des gravures et des articles de ce journal est absolument interdite, même par extrait .",Journal_des_dames_et_des_modes_1913-03-10_journal-des-dames-et-des-modes-10-marzo-1913.txt
"C’est „ che,s , et tout Paris : Meubles divers, chambres à ( l u il est très facile à digér. r m qm ? lt -- ' • ' I me,lleurs médecins l’ordonnent T„ ^ leS lescents. aux dvspeptiaues ëî conva - lards. uyspepuques et aux vieil. dre F ^ e T 9 la ru e a q que , ^""grenier et l’a- ’ rue des Saints-pères, Paris.",Femina_1908-10-15_femina186-1908.txt
"La sercnde quinzaine d’octobre voit 33 précipiter le retour de la plupart des Parisiens, qui reviennent qui de Biarritz, qui de leurs châteaux, qui encore de chasser chez des amis en province. Pourtant certains goûtent encore le charme des derniers beaux jours à Venise ou sur sa magnifique plage du Lido, dont la saison mondaine battait son plein vers la fin du mois dernier. Malgré tout, le Bois a repris son ani¬ mation matinale.",Femina_1908-10-15_femina186-1908.txt
"Le grand flacon cristal 18 fr. 50. N NOTE D'ÉLÉGANCE (^haque fois que la mode décrète une transformation de la silhouette fémi¬ nine, la perspicacité des plus élégantes Parisiennes sait décou¬ vrir, de façon infaillible, celui des corsets qui, entre tous, la réalise de la façon la plus parfaite. Ne cherchez pas d’autre explication de la vogue extraordinaire et toute récente des magnifiques corsets Perséphone n°90Q.",Femina_1908-10-15_femina186-1908.txt
"Mais, le commentaire, vous l’avez, — muet sans doute, et d’autant plus éloquent. Il vous sera donné par les chefs-d’œuvre de l’art. 0 0 0 Où, comment, les évoquerez-vous, ces chefs- d'œuvre, dans le désert de votre petite ville de province ? Bien simplement, vous allez voir. Par de bonnes reproductions, et qui ne vous coûteront pas cher.",Femina_1908-10-15_femina186-1908.txt
", C’est assez pour apprendre a vos filles comment sont nées les belles œuvres humaines. Une tige ne vous donne-t-elle pas la ligne, un calice, le galbe, un coucher de soleil, la couleur . Loin d’avoir à vous contenter des modèles les plus humbles, c’est en eux que vous trouvez 1 essen¬ tiel. C’est avec une plante sauvage, une grammee des champs, que vous démontrerez d ou naît la grâce de la forme, et combien elle s accorde avant tout avec la simplicité du dessin.",Femina_1908-10-15_femina186-1908.txt
"— Les ceintures se font très étroites : un mince ruban de soie passé et retourné dans des anneaux plats d’écaille, d’ambre ou de jade , que quelques dames emploient aussi comme coulants de cravate sur des blouses chemisier. VILLA VA AE A la feuille de ce jour sont jointes les gravures 56 et 57. L22122:2:2::2:2250 La reproduction des gravures et des articles de ce journal est absolument interdite, même par extrait.",Journal_des_dames_et_des_modes_1913-02-20_journal-des-dames-et-des-modes-20-febbraio-1913.txt
"» et autres formules évangéliques, aussitôt que de méprisables persi¬ fleurs commencent à exercer sur autrui leur saga¬ cité malfaisante et bien trop facilement comique, hélas ! — un pareil jeune homme mérite son rang à part dans l’estime mondaine et les sympathies féminines. Mais on périrait de langueur et d’en¬ nui, dites-vous, en une société où chacun se pré¬ vaudrait d’une âme aussi vertueuse ? k Ah ! tant pis!",Femina_1908-10-15_femina186-1908.txt
"Se porte directement sur la Veau AVANTAGES Le CRÊPE de SANTÉ b a c conserve au corps la souplesse, respecte l’élégance des contours, sèche toute transpiration, main¬ tient la chaleur, évite le re¬ froidissement, est résistant à l’usage, est facilement lavable et irrétrécissable. ^PÊdeS^- IRRÉTRÉCISSABLE B&.C.",Femina_1908-10-15_femina186-1908.txt
"—, CONCOURS W., 250. — Même réponse. Mme David. — Nous ne Ÿ éciati A É pouvons encore vous donner d'appréciation avan N° 3 et 4 l'examen du jury. Fe : | (Numéro du 15 février). Danièle S. W. — L'idée est originale mais demande la perfection dans l’exé- Sujet du Concours cution. N° 3 : AVEC LES INITIA- Lucy et Lucie.",Femina_1901-03-01_femina1-3.txt
", NysiENIQÜÊj Morts ~ ^ ^t& lïopy de Maison spéciale et la mieux assortie de cheveux et frisures naturelles Servi dans tous les établissements de consommation en bouteille a origine, le BYRRH se trouve dans toutes les maisons d'alimentation CONCOURS BYRRH - VOIR NOTRE NUMÉRO DU 15 MARS 1908 - LIBERTYCO 38, AVENUE DE LOPÉR A, PARIS VELOURS LIBERTY VELOURS LA MARQUE LIBERTY ETANT NOTRE PROPRIETE EXCLU¬ LIBERTY VELOURS SIVE LES TISSUS VENDUS AILLEURS QUE 38, AVENUE ne i • a D C D 1 kj c QHMT LIBERTY VELOURS U t L Ur t n ne, aun 1 QUE DES 1 MITAT IONS LIBERTY VELOURS LIBERTY VELOURS VELOURS LIBERTY VELOURS L 1 B E R T Y Un velours de coton LIBERTY VELOURS d’une souplesse in¬ comparable et d’une LIBERTY VELOURS qualité unique, le tissu d’hiver par ex¬ LIBERTY VELOURS cellence pour robes do Ville, Robes d’In- LIBERTY VELOURS térieuret Manteaux.",Femina_1908-10-15_femina186-1908.txt
"Sinon s’abresser pour renseignements etablissements FURCLI et OPPenijeim, Paris. a ,enis aux Fabricants : XXV XXV A NOS LECTRICES J» £» ABONNÉES Primes et Avantages offerts par FEMINA Voiliez-vous, lectrices, que nous par¬ lions aujourd’hui de tous les avantages dont jouissent les nouvelles abonnées de Fetnina et qui en font, non seulement le magazine le plus complet de la femme, le plus littéraire, le plus artis¬ tique, mais encore le meilleur marché •qui se puisse trouver.",Femina_1908-10-15_femina186-1908.txt
